{
  "schema_version": "8dionysus_codex_organ_fabric_manifest_v1",
  "updated_at": "2026-07-26T23:54:12Z",
  "production_protocol": "2025-11-25",
  "consumer": {
    "product": "codex-cli",
    "observed_version": "0.145.0",
    "configuration_scope": "global_plus_trusted_project",
    "dynamic_reload_posture": "new_process_required",
    "catalog_refresh_posture": "reobserve_after_registration_or_schema_change"
  },
  "owner_boundaries": {
    "projection_owner": "8Dionysus",
    "registry_owner": "aoa-sdk",
    "runtime_owner": "abyss-stack",
    "apply_authority": "operator"
  },
  "catalog_policy": {
    "always_loaded_full_catalog_forbidden": true,
    "profile_selection_required": true,
    "max_registrations_per_profile": 6,
    "max_enabled_tools_per_profile": 64,
    "legacy_baseline": {
      "captured_at": "2026-07-25T20:04:06Z",
      "active_server_count": 10,
      "active_tool_count": 118,
      "active_tool_catalog_bytes": 74098,
      "source_ref": "artifact://os-abyss-mcp-r1-baseline-20260725/r1-baseline-dossier.json",
      "source_digest": "sha256:1caab18801716c002647f32f3c6d48fd6770d6ed2c1cdfe05832c1b698b59553"
    }
  },
  "profiles": {
    "core-read": {
      "description": "Compact KAG, stats, and decision navigation.",
      "allowed_policy_families": [
        "read"
      ]
    },
    "runtime-read": {
      "description": "Stack and machine diagnostics without runtime effects.",
      "allowed_policy_families": [
        "read"
      ]
    },
    "memory-read": {
      "description": "Durable-memory access and session-evidence retrieval without writes.",
      "allowed_policy_families": [
        "read"
      ]
    },
    "proof-read": {
      "description": "Bounded eval discovery and candidate shaping without proof acceptance.",
      "allowed_policy_families": [
        "read"
      ]
    },
    "corpus-read": {
      "description": "Tree of Sophia authored-corpus resources and bounded graph reads.",
      "allowed_policy_families": [
        "read"
      ]
    },
    "connectors-read": {
      "description": "Local connector evidence only; no provider network or external effects.",
      "allowed_policy_families": [
        "read"
      ]
    },
    "candidate": {
      "description": "Explicit candidate-only contours with per-tool prompts.",
      "allowed_policy_families": [
        "candidate"
      ]
    }
  },
  "registrations": [
    {
      "registration_name": "aoa_decisions",
      "organ_id": "aoa-decisions",
      "policy_family": "read",
      "effect_ceiling": "derive",
      "registry_state": "shadow",
      "registry_record_ref": "registry://aoa-decisions/read",
      "source_service_ref": "abyss-stack/mcp/services/aoa-decisions-mcp/",
      "url": "http://127.0.0.1:5420/mcp",
      "bearer_token_env_var": "AOA_DECISIONS_MCP_READ_BEARER_TOKEN",
      "credential_class": "aoa-decisions-mcp-read",
      "protocol_versions": [
        "2025-11-25"
      ],
      "profiles": [
        "core-read"
      ],
      "enabled_tools": [
        "aoa_decisions_status",
        "aoa_decisions_search",
        "aoa_decisions_packet",
        "aoa_decisions_decision",
        "aoa_decisions_owner_surface"
      ],
      "startup_timeout_sec": 20,
      "tool_timeout_sec": 60,
      "required": false,
      "default_tools_approval_mode": "writes",
      "expected_schema_digest": null,
      "receipts": {
        "admission": null,
        "consumer_schema": null,
        "canary": null,
        "owner_acceptance": null,
        "rollback": null
      },
      "rollback_route": "owner://aoa-decisions/rollback/shadow"
    },
    {
      "registration_name": "aoa_kag",
      "organ_id": "aoa-kag",
      "policy_family": "read",
      "effect_ceiling": "derive",
      "registry_state": "shadow",
      "registry_record_ref": "registry://aoa-kag/read",
      "source_service_ref": "abyss-stack/mcp/services/aoa-kag-mcp/",
      "url": "http://127.0.0.1:5425/mcp",
      "bearer_token_env_var": "AOA_KAG_MCP_READ_BEARER_TOKEN",
      "credential_class": "aoa-kag-mcp-read",
      "protocol_versions": [
        "2025-11-25"
      ],
      "profiles": [
        "core-read"
      ],
      "enabled_tools": [
        "kag_discover",
        "kag_search",
        "kag_read",
        "kag_traverse",
        "kag_explain"
      ],
      "startup_timeout_sec": 20,
      "tool_timeout_sec": 90,
      "required": false,
      "default_tools_approval_mode": "writes",
      "expected_schema_digest": null,
      "receipts": {
        "admission": null,
        "consumer_schema": null,
        "canary": null,
        "owner_acceptance": null,
        "rollback": null
      },
      "rollback_route": "owner://aoa-kag/rollback/shadow"
    },
    {
      "registration_name": "aoa_stats",
      "organ_id": "aoa-stats",
      "policy_family": "read",
      "effect_ceiling": "derive",
      "registry_state": "shadow",
      "registry_record_ref": "registry://aoa-stats/read",
      "source_service_ref": "abyss-stack/mcp/services/aoa-stats-mcp/",
      "url": "http://127.0.0.1:5430/mcp",
      "bearer_token_env_var": "AOA_STATS_MCP_READ_BEARER_TOKEN",
      "credential_class": "aoa-stats-mcp-read",
      "protocol_versions": [
        "2025-11-25"
      ],
      "profiles": [
        "core-read"
      ],
      "enabled_tools": [
        "stats_catalog",
        "stats_boundary_rules",
        "stats_surface_read",
        "stats_owner_port_read",
        "stats_packet_check"
      ],
      "startup_timeout_sec": 20,
      "tool_timeout_sec": 60,
      "required": false,
      "default_tools_approval_mode": "writes",
      "expected_schema_digest": null,
      "receipts": {
        "admission": null,
        "consumer_schema": null,
        "canary": null,
        "owner_acceptance": null,
        "rollback": null
      },
      "rollback_route": "owner://aoa-stats/rollback/shadow"
    },
    {
      "registration_name": "abyss_machine",
      "organ_id": "abyss-machine",
      "policy_family": "read",
      "effect_ceiling": "observe",
      "registry_state": "shadow",
      "registry_record_ref": "registry://abyss-machine/read",
      "source_service_ref": "abyss-stack/mcp/services/abyss-machine-mcp/",
      "url": "http://127.0.0.1:5423/mcp",
      "bearer_token_env_var": "ABYSS_MACHINE_MCP_READ_BEARER_TOKEN",
      "credential_class": "abyss-machine-mcp-read",
      "protocol_versions": [
        "2025-11-25"
      ],
      "profiles": [
        "runtime-read"
      ],
      "enabled_tools": [
        "abyss_machine_brief",
        "abyss_machine_route",
        "abyss_machine_context_packet",
        "abyss_machine_evidence_map"
      ],
      "startup_timeout_sec": 20,
      "tool_timeout_sec": 90,
      "required": false,
      "default_tools_approval_mode": "writes",
      "expected_schema_digest": null,
      "receipts": {
        "admission": null,
        "consumer_schema": null,
        "canary": null,
        "owner_acceptance": null,
        "rollback": null
      },
      "rollback_route": "owner://abyss-machine/rollback/shadow"
    },
    {
      "registration_name": "abyss_stack_read",
      "organ_id": "abyss-stack",
      "policy_family": "read",
      "effect_ceiling": "observe",
      "registry_state": "shadow",
      "registry_record_ref": "registry://abyss-stack/read",
      "source_service_ref": "abyss-stack/mcp/services/abyss-stack-mcp/",
      "url": "http://127.0.0.1:5431/mcp",
      "bearer_token_env_var": "ABYSS_STACK_MCP_READ_BEARER_TOKEN",
      "credential_class": "abyss-stack-mcp-read",
      "protocol_versions": [
        "2025-11-25"
      ],
      "profiles": [
        "runtime-read"
      ],
      "enabled_tools": [
        "stack_runtime_catalog",
        "stack_runtime_inspect"
      ],
      "startup_timeout_sec": 30,
      "tool_timeout_sec": 90,
      "required": false,
      "default_tools_approval_mode": "writes",
      "expected_schema_digest": null,
      "receipts": {
        "admission": null,
        "consumer_schema": null,
        "canary": null,
        "owner_acceptance": null,
        "rollback": null
      },
      "rollback_route": "owner://abyss-stack/rollback/read-shadow"
    },
    {
      "registration_name": "aoa_memo",
      "organ_id": "aoa-memo",
      "policy_family": "read",
      "effect_ceiling": "validate",
      "registry_state": "shadow",
      "registry_record_ref": "registry://aoa-memo/read",
      "source_service_ref": "abyss-stack/mcp/services/aoa-memo-mcp/",
      "url": "http://127.0.0.1:5421/mcp",
      "bearer_token_env_var": "AOA_MEMO_MCP_READ_BEARER_TOKEN",
      "credential_class": "aoa-memo-mcp-read",
      "protocol_versions": [
        "2025-11-25"
      ],
      "profiles": [
        "memory-read"
      ],
      "enabled_tools": [
        "aoa_memo_brief",
        "aoa_memo_search",
        "aoa_memo_validate_candidate",
        "aoa_memo_build_port_index",
        "aoa_memo_validate_port",
        "aoa_memo_pending_exports",
        "aoa_memo_landing_plan"
      ],
      "startup_timeout_sec": 20,
      "tool_timeout_sec": 90,
      "required": false,
      "default_tools_approval_mode": "writes",
      "expected_schema_digest": null,
      "receipts": {
        "admission": null,
        "consumer_schema": null,
        "canary": null,
        "owner_acceptance": null,
        "rollback": null
      },
      "rollback_route": "owner://aoa-memo/rollback/read-shadow"
    },
    {
      "registration_name": "aoa_session_memory",
      "organ_id": "aoa-session-memory",
      "policy_family": "read",
      "effect_ceiling": "derive",
      "registry_state": "shadow",
      "registry_record_ref": "registry://aoa-session-memory/read",
      "source_service_ref": "abyss-stack/mcp/services/aoa-session-memory-mcp/",
      "url": "http://127.0.0.1:5422/mcp",
      "bearer_token_env_var": "AOA_SESSION_MEMORY_MCP_READ_BEARER_TOKEN",
      "credential_class": "aoa-session-memory-mcp-read",
      "protocol_versions": [
        "2025-11-25"